<?xml version="1.0" encoding="UTF-8"?>
<tns:Solvis homeId="" xmlns:tns="http://www.example.org/control" xmlns:xsi="http://www.w3.org/2001/XMLSchema-instance" xsi:schemaLocation="http://www.example.org/control control.xsd ">
  <tns:Screens>
    <tns:Screen back="" id="" previous="" pushDurationMs="0">
      <tns:TouchPoint X="0" Y="0"/>
      <tns:ScreenOcr value="">
        <tns:Field>
          <tns:TopLeft X="0" Y="0"/>
          <tns:BottomRight X="0" Y="0"/>
        </tns:Field>
      </tns:ScreenOcr>
      <tns:ScreenGrafic exact="true" id="">
        <tns:Field>
          <tns:TopLeft X="0" Y="0"/>
          <tns:BottomRight X="0" Y="0"/>
        </tns:Field>
      </tns:ScreenGrafic>
    </tns:Screen>
  </tns:Screens>
  <tns:Controls>
    <tns:Control id="" screenName="">
      <tns:TypeValue format="" increment="0" least="0" most="0" wrapAround="true">
        <tns:TouchUpper X="0" Y="0"/>
        <tns:TouchLower X="0" Y="0"/>
      </tns:TypeValue>
      <tns:TypeMode>
        <tns:Mode id="">
          <tns:Touch X="0" Y="0"/>
        </tns:Mode>
      </tns:TypeMode>
      <tns:Current>
        <tns:TopLeft X="0" Y="0"/>
        <tns:BottomRight X="0" Y="0"/>
      </tns:Current>
    </tns:Control>
  </tns:Controls>
  <tns:AllScreenGrafics>
    <tns:ScreenGrafic exact="true" id="">
      <tns:Field>
        <tns:TopLeft X="0" Y="0"/>
        <tns:BottomRight X="0" Y="0"/>
      </tns:Field>
    </tns:ScreenGrafic>
  </tns:AllScreenGrafics>
</tns:Solvis>
